{
    "$schema": "http://json-schema.org/draft-07/schema#",
    "title": "Context Bundler Manifest",
    "description": "Schema for defining a bundle of files for context generation.",
    "type": "object",
    "properties": {
        "title": {
            "type": "string",
            "description": "Title of the generated context document."
        },
        "description": {
            "type": "string",
            "description": "Optional description included at the top of the bundle."
        },
        "excludes": {
            "type": "array",
            "description": "Optional list of glob patterns to exclude from recursive directory bundling (e.g., ['*.svg', 'tests/*']).",
            "items": {
                "type": "string"
            }
        },
        "files": {
            "type": "array",
            "description": "List of files to include in the bundle. IMPORTANT: The first file MUST be the prompt/instruction file.",
            "items": {
                "type": "object",
                "properties": {
                    "path": {
                        "type": "string",
                        "description": "Relative path to the file or directory to include."
                    },
                    "note": {
                        "type": "string",
                        "description": "Optional note or annotation about this file."
                    }
                },
                "required": [
                    "path"
                ]
            }
        }
    },
    "required": [
        "title",
        "files"
    ]
}